{
  "$schema": "https://json-schema.org/draft/2020-12/schema",
  "$id": "https://starlight.frankx.ai/schema/research-packet.v1.json",
  "title": "ResearchPacket.v1",
  "description": "A dated research week expressed as a typed graph. Every node carries owner, provenance, version, visibility and an evaluation rule. Numbers exist only as Claim values, and a Claim value is promotable only when it resolves to a Source.",
  "type": "object",
  "required": ["schemaVersion", "packetId", "week", "owner", "visibility", "nodes"],
  "additionalProperties": false,
  "properties": {
    "schemaVersion": { "const": "ResearchPacket.v1" },
    "packetId": { "$ref": "#/$defs/id" },
    "week": {
      "type": "object",
      "required": ["startsOn", "endsOn"],
      "additionalProperties": false,
      "properties": {
        "startsOn": { "$ref": "#/$defs/date" },
        "endsOn": { "$ref": "#/$defs/date" },
        "title": { "type": "string" }
      }
    },
    "owner": { "type": "string", "minLength": 1 },
    "visibility": { "enum": ["internal", "public-preview", "public"] },
    "nodes": {
      "type": "object",
      "additionalProperties": false,
      "properties": {
        "models": { "type": "array", "items": { "$ref": "#/$defs/model" } },
        "capabilities": { "type": "array", "items": { "$ref": "#/$defs/capability" } },
        "benchmarks": { "type": "array", "items": { "$ref": "#/$defs/benchmark" } },
        "sources": { "type": "array", "items": { "$ref": "#/$defs/source" } },
        "claims": { "type": "array", "items": { "$ref": "#/$defs/claim" } },
        "repos": { "type": "array", "items": { "$ref": "#/$defs/repo" } },
        "dependencies": { "type": "array", "items": { "$ref": "#/$defs/dependency" } },
        "decisions": { "type": "array", "items": { "$ref": "#/$defs/decision" } },
        "artifacts": { "type": "array", "items": { "$ref": "#/$defs/artifact" } },
        "reviews": { "type": "array", "items": { "$ref": "#/$defs/review" } },
        "promotions": { "type": "array", "items": { "$ref": "#/$defs/promotion" } }
      }
    }
  },
  "$defs": {
    "id": { "type": "string", "pattern": "^[a-z][a-z0-9-]{2,63}$" },
    "date": { "type": "string", "pattern": "^\\d{4}-\\d{2}-\\d{2}$" },
    "instant": { "type": "string", "pattern": "^\\d{4}-\\d{2}-\\d{2}T\\d{2}:\\d{2}:\\d{2}Z$" },

    "model": {
      "type": "object",
      "required": ["id", "name", "vendor"],
      "additionalProperties": false,
      "properties": {
        "id": { "$ref": "#/$defs/id" },
        "name": { "type": "string" },
        "vendor": { "type": "string" },
        "releasedOn": { "$ref": "#/$defs/date" }
      }
    },

    "capability": {
      "type": "object",
      "required": ["id", "name", "kind"],
      "additionalProperties": false,
      "properties": {
        "id": { "$ref": "#/$defs/id" },
        "name": { "type": "string" },
        "kind": { "enum": ["reasoning", "orchestration", "runtime", "economics", "tool-use", "coding"] },
        "modelIds": { "type": "array", "items": { "$ref": "#/$defs/id" } }
      }
    },

    "benchmark": {
      "type": "object",
      "required": ["id", "name", "unit", "direction"],
      "additionalProperties": false,
      "properties": {
        "id": { "$ref": "#/$defs/id" },
        "name": { "type": "string" },
        "unit": { "type": "string" },
        "direction": { "enum": ["higher-is-better", "lower-is-better"] },
        "operator": { "type": "string" }
      }
    },

    "source": {
      "type": "object",
      "required": ["id", "name", "kind", "resolution"],
      "additionalProperties": false,
      "properties": {
        "id": { "$ref": "#/$defs/id" },
        "name": { "type": "string" },
        "kind": { "enum": ["index", "paper", "vendor-doc", "post", "repo", "measurement", "internal-run"] },
        "locator": {
          "description": "URL or repo path. Null when the source is named but was not retrieved in this run. Never invent one.",
          "type": ["string", "null"]
        },
        "resolution": {
          "description": "retrieved: fetched and read in this run. named-unretrieved: a real named source that was not opened. absent: no source exists.",
          "enum": ["retrieved", "named-unretrieved", "absent"]
        },
        "retrievedAt": { "$ref": "#/$defs/instant" }
      }
    },

    "claim": {
      "type": "object",
      "description": "The only node type allowed to carry a value. Promotion refuses any claim whose value is numeric and whose sourceIds do not resolve.",
      "required": ["id", "subject", "predicate", "value", "observedAt", "freshnessWindowDays", "sourceIds", "status"],
      "additionalProperties": false,
      "properties": {
        "id": { "$ref": "#/$defs/id" },
        "subject": {
          "description": "Node id this claim is about (a model, capability, repo, or artifact).",
          "$ref": "#/$defs/id"
        },
        "predicate": { "type": "string", "minLength": 1 },
        "value": { "type": ["number", "string", "boolean", "null"] },
        "unit": { "type": ["string", "null"] },
        "benchmarkId": { "$ref": "#/$defs/id" },
        "observedAt": { "$ref": "#/$defs/date" },
        "freshnessWindowDays": { "type": "integer", "minimum": 1 },
        "sourceIds": { "type": "array", "items": { "$ref": "#/$defs/id" } },
        "derivedFrom": {
          "description": "Claim ids this value was computed from. A derived claim is never more sourced than its weakest parent.",
          "type": "array",
          "items": { "$ref": "#/$defs/id" }
        },
        "status": {
          "description": "sourced: every source resolves as retrieved. named-unverified: sources are named but unretrieved. unsourced: no source. TRUTH.md forbids hand-typed numbers, so an unsourced numeric claim is a promotion blocker, never a rounding error.",
          "enum": ["sourced", "named-unverified", "unsourced"]
        },
        "text": { "type": "string", "description": "Prose rendering used when this claim is promoted." }
      }
    },

    "repo": {
      "type": "object",
      "required": ["id", "slug", "owner", "visibility"],
      "additionalProperties": false,
      "properties": {
        "id": { "$ref": "#/$defs/id" },
        "slug": { "type": "string" },
        "owner": { "type": "string" },
        "visibility": { "enum": ["private", "public"] },
        "role": { "type": "string" }
      }
    },

    "dependency": {
      "type": "object",
      "required": ["id", "fromRepoId", "toRepoId", "kind"],
      "additionalProperties": false,
      "properties": {
        "id": { "$ref": "#/$defs/id" },
        "fromRepoId": { "$ref": "#/$defs/id" },
        "toRepoId": { "$ref": "#/$defs/id" },
        "kind": { "enum": ["package", "schema", "content", "deploy", "doctrine"] },
        "version": { "type": "string" }
      }
    },

    "decision": {
      "type": "object",
      "required": ["id", "statement", "decidedOn", "owner", "status"],
      "additionalProperties": false,
      "properties": {
        "id": { "$ref": "#/$defs/id" },
        "statement": { "type": "string" },
        "decidedOn": { "$ref": "#/$defs/date" },
        "owner": { "type": "string" },
        "status": { "enum": ["open", "ruled", "void"] },
        "claimIds": { "type": "array", "items": { "$ref": "#/$defs/id" } }
      }
    },

    "artifact": {
      "type": "object",
      "required": ["id", "kind", "path", "visibility"],
      "additionalProperties": false,
      "properties": {
        "id": { "$ref": "#/$defs/id" },
        "kind": { "enum": ["essay", "map", "table", "schema", "packet", "page"] },
        "path": { "type": "string" },
        "visibility": { "enum": ["internal", "public-preview", "public"] },
        "claimIds": { "type": "array", "items": { "$ref": "#/$defs/id" } }
      }
    },

    "review": {
      "type": "object",
      "required": ["id", "targetId", "reviewer", "verdict", "reviewedOn"],
      "additionalProperties": false,
      "properties": {
        "id": { "$ref": "#/$defs/id" },
        "targetId": { "$ref": "#/$defs/id" },
        "reviewer": { "type": "string" },
        "verdict": { "enum": ["pass", "block", "needs-source"] },
        "reviewedOn": { "$ref": "#/$defs/date" },
        "notes": { "type": "string" }
      }
    },

    "promotion": {
      "type": "object",
      "required": ["id", "artifactId", "target", "state", "claimIds"],
      "additionalProperties": false,
      "properties": {
        "id": { "$ref": "#/$defs/id" },
        "artifactId": { "$ref": "#/$defs/id" },
        "target": { "enum": ["frankx.ai", "starlightintelligence.ai", "internal"] },
        "state": { "enum": ["proposed", "blocked", "approved", "published"] },
        "claimIds": { "type": "array", "items": { "$ref": "#/$defs/id" } },
        "blockedBy": { "type": "array", "items": { "type": "string" } }
      }
    }
  }
}
